{"$schema":"https://json-schema.org/draft/2020-12/schema","$id":"https://cask23.co.uk/schemas/cask23-distillery-profile.schema.json","title":"Cask23DistilleryProfile","description":"Schema for Cask 23 Project Zero verified distillery governance profiles.","type":"object","required":["distilleryId","slug","officialName","entityType","country","governanceStatus"],"properties":{"distilleryId":{"type":"string","description":"Unique identifier, e.g., 'DIST-ARDBEG'.","pattern":"^DIST-[A-Z0-9_-]+$"},"slug":{"type":"string","description":"URL-safe string identifier, e.g., 'ardbeg'.","pattern":"^[a-z0-9_-]+$"},"officialName":{"type":"string","description":"The officially verified name of the distillery."},"entityType":{"type":"string","enum":["DISTILLERY","INDEPENDENT_BOTTLER","BRAND/PRODUCER","UNDISCLOSED_DISTILLERY","REVIEW_REQUIRED"],"description":"The category resolved during entity reconciliation."},"country":{"type":"string","description":"Country where the facility is physically located."},"region":{"type":"string","description":"Specific whisky region where applicable. Optional for world whisky; never manufacture a region."},"founded":{"type":"integer","description":"The year the distillery was established.","minimum":1400,"maximum":2026},"owner":{"type":"string","description":"Current parent company or owner entity."},"location":{"type":"string","description":"Physical geographic coordinates or postal address details."},"operationalStatus":{"type":"string","enum":["ACTIVE","SILENT","DEMOLISHED","UNKNOWN"],"description":"The current operational state of the production facility."},"production":{"type":"object","description":"Factual technical production specifications backed by credible evidence.","properties":{"waterSource":{"type":"string","description":"Verified geological or named water source location."},"malt":{"type":"string","description":"Barley sourcing or malting specifications."},"fermentation":{"type":"string","description":"Details regarding fermentation times or washback materials used."},"stills":{"type":"string","description":"Still configuration particulars, sizes, styles, or unique mechanics."},"peat":{"type":"string","description":"Peated or unpeated details, including PPM levels if verified."},"maturation":{"type":"string","description":"Cask filling philosophy and warehousing environmental types."}},"additionalProperties":false},"houseCharacter":{"type":"string","description":"A high-density summary of the structural, verified base flavour profile."},"cask23Narrative":{"type":"string","description":"The consumer-facing editorial profile focused strictly on helping a customer appreciate the whisky."},"verificationDate":{"type":"string","format":"date","description":"The date this profile data was QA checked and verified (YYYY-MM-DD)."},"evidenceTier":{"type":"string","enum":["TIER_1_OFFICIAL","TIER_2_ESTABLISHED_SPECIALIST","TIER_3_UNVERIFIED"],"description":"The highest quality source grading backing the technical specs."},"sources":{"type":"array","description":"Verifiable links, publications, or source records utilised for the entry.","items":{"type":"string"}},"governanceStatus":{"type":"string","enum":["UNVERIFIED","SOURCE_VERIFIED","FOUNDER_REVIEW","FOUNDER_APPROVED"],"description":"The sign-off lifecycle state of this specific profile."}},"additionalProperties":false}